{
  "$schema": "https://json-schema.org/draft/2020-12/schema",
  "title": "PlayerTuning",
  "description": "Data-driven physics parameters for the player character",
  "type": "object",
  "required": [
    "accel",
    "drag",
    "maxSpeed",
    "jumpVelocity",
    "coyoteMs",
    "jumpBufferMs",
    "gravityScale",
    "terminalVelocity"
  ],
  "properties": {
    "accel": {
      "type": "number",
      "minimum": 0,
      "description": "Horizontal acceleration (pixels/sec²)"
    },
    "drag": {
      "type": "number",
      "minimum": 0,
      "description": "Horizontal drag when no input (pixels/sec²)"
    },
    "maxSpeed": {
      "type": "number",
      "minimum": 0,
      "description": "Maximum horizontal speed while walking (pixels/sec)"
    },
    "sprintMaxSpeed": {
      "type": "number",
      "minimum": 0,
      "description": "Maximum horizontal speed while the sprint key is held (pixels/sec). A gap-width dial: jump reach is airtime x speed, and airtime is fixed by jumpVelocity and gravity, so this is the only number that changes how wide a gap can be crossed. At 160 a jump reaches 5.9 tiles; at 265 it reaches 9.8."
    },
    "sprintDecayPerSec": {
      "type": "number",
      "minimum": 0,
      "description": "How much of the sprint ceiling is given back per second after the key is released, while airborne (pixels/sec per sec). Zero snaps straight back to maxSpeed, which reads as hitting a wall mid-jump."
    },
    "jumpVelocity": {
      "type": "number",
      "minimum": 0,
      "description": "Initial upward velocity on jump (pixels/sec)"
    },
    "coyoteMs": {
      "type": "number",
      "minimum": 0,
      "description": "Grace period after leaving edge (ms)"
    },
    "jumpBufferMs": {
      "type": "number",
      "minimum": 0,
      "description": "Jump input buffer window (ms)"
    },
    "gravityScale": {
      "type": "number",
      "minimum": 0,
      "description": "Gravity multiplier (1.0 = normal)"
    },
    "terminalVelocity": {
      "type": "number",
      "minimum": 0,
      "description": "Maximum fall speed (pixels/sec)"
    },
    "_feelComment": {
      "type": "string"
    },
    "feel": {
      "type": "object",
      "description": "Squash and stretch (brand/BRAND_SYSTEM.md §2.4). Read by player.gd only; PlayerMotion never sees it, so none of this can move the golden motion fixtures.",
      "required": [
        "apexVy",
        "riseScaleY",
        "riseScaleX",
        "fallScaleY",
        "fallScaleX",
        "landSquashY",
        "landSquashX",
        "landSquashMs",
        "landOvershootY",
        "landOvershootX",
        "landSettleMs",
        "shapeLerp"
      ],
      "additionalProperties": false,
      "properties": {
        "apexVy": {
          "type": "number",
          "minimum": 0,
          "description": "|vy| below which the crow is at its apex and stops stretching (px/sec)"
        },
        "riseScaleY": {
          "type": "number",
          "minimum": 0,
          "description": "Vertical stretch while ascending"
        },
        "riseScaleX": {
          "type": "number",
          "minimum": 0,
          "description": "Horizontal squeeze while ascending"
        },
        "fallScaleY": {
          "type": "number",
          "minimum": 0,
          "description": "Vertical stretch while descending"
        },
        "fallScaleX": {
          "type": "number",
          "minimum": 0,
          "description": "Horizontal squeeze while descending"
        },
        "landSquashY": {
          "type": "number",
          "minimum": 0,
          "description": "Vertical squash on the landing frame"
        },
        "landSquashX": {
          "type": "number",
          "minimum": 0,
          "description": "Horizontal spread on the landing frame"
        },
        "landSquashMs": {
          "type": "number",
          "minimum": 0,
          "description": "Squash-to-overshoot duration (ms)"
        },
        "landOvershootY": {
          "type": "number",
          "minimum": 0,
          "description": "Vertical overshoot past neutral"
        },
        "landOvershootX": {
          "type": "number",
          "minimum": 0,
          "description": "Horizontal overshoot past neutral"
        },
        "landSettleMs": {
          "type": "number",
          "minimum": 0,
          "description": "Overshoot-to-neutral duration (ms)"
        },
        "shapeLerp": {
          "type": "number",
          "minimum": 0,
          "description": "How fast the airborne shape eases toward its target (per second)"
        }
      }
    }
  },
  "additionalProperties": false
}
